{"build10_readiness":"J13-J17-BINDING-STILL-BLOCKING","closed_vocabularies":{"colour_code_7_outcomes":["official-device-value-established","official-semantic-black","official-palette-entry","official-code-output-profile-dependent","official-code-only","indeterminate"],"gate_states":["P2-production-candidate","version-scoped-production-candidate","local-policy-required","local-output-profile-policy-required","HOLD-indeterminate"],"j13_j17_outcomes":["J13-authoritative-production-binding","J17-authoritative-production-binding","version-scoped-dual-binding","different-semantic-roles","official-binding-not-published-or-not-available","indeterminate"],"line_code_2_outcomes":["official-physical-width-established","official-symbolic-line-class","official-code-output-profile-dependent","official-code-only","indeterminate"],"readiness_decisions":["READY-FOR-HUMAN-POLICY-GATE","J13-J17-BINDING-STILL-BLOCKING","PORTRAYAL-CODE-EVIDENCE-STILL-BLOCKING","TARGETED-OFFICIAL-EVIDENCE-STILL-MISSING"],"verdicts":["PASS — TARGETED OFFICIAL EVIDENCE CLOSED; HUMAN PRODUCTION POLICY GATE READY","PASS — PORTRAYAL EVIDENCE CLOSED; J13/J17 PRODUCTION BINDING STILL MISSING","PASS — J13/J17 RESOLVED; PORTRAYAL CODE EVIDENCE STILL MISSING","PASS — TARGETED EVIDENCE CLOSURE PARTIAL; OFFICIAL EVIDENCE STILL MISSING","FAIL — TARGETED OFFICIAL EVIDENCE BOUNDARY NOT ESTABLISHED"]},"colour_code_7_resolution":{"authority_boundary":"official table defines semantic black and the original RGB (R-G-B) value (0,0,0); no HEX notation is stated","evidence_ids":["nlsc112v5.4-building-portrayal-row","nlsc112-18-portrayal-code-table"],"official_code":"7","official_hex":null,"original_representation":{"components":[0,0,0],"representation":"RGB值 (R-G-B)","value_text":"(0,0,0)"},"outcome":"official-device-value-established","semantic_name":"黑色"},"conflicting_authoritative_evidence":[],"contract_version":"build-09e1/1.0","created_on":"2026-08-21","evidence_items":[{"authority_class":"frozen-reviewed-project-evidence","claim":"BUILD-09E closed annotation, hatch, and PolygonZ findings and limited the remaining official gaps to exactly J13/J17, line code 2, and colour code 7","evidence_id":"build09e-frozen-evidence-closure","identity":"record:bfee262f17b5bc99ff8e55f6b284917cf5507aaa80b0e3bae2454e35da4fbaed; file-sha256:f65862c85ce2ed9e9ea7b2217d4d3a2cd6abf863c2532ab79cf803aa0860e673","source":"data/specifications/nma-build-09e-golden-official-evidence-closure-v1.0.json"},{"authority_class":"authoritative-official-specification","claim":"permanent Building 9310100 uses line code 2 and colour code 7, with 2 mm hatch spacing and floor-then-structure annotation","evidence_id":"nlsc112v5.4-building-portrayal-row","identity":"NLSC112V5.4; effective:2024-02-28; sha256:1f9c4457d7ced86f2b7681e21be9ad3b7b7ae364981ab995ef27b468e0fa2620#page=8","source":"01-一千分之一地形圖圖式規格表.pdf; Drive file 1KQN1GCwVPFSms3IUi4pmNqM4ru3TYVrZ; page 8"},{"authority_class":"authoritative-versioned-source-documentation","claim":"Figure 2-3 defines line code 2 as 0.20 mm and colour code 7 as black with RGB value (R-G-B) (0,0,0)","evidence_id":"nlsc112-18-portrayal-code-table","identity":"NLSC-112-18; commissioned-by:內政部國土測繪中心; report-date:112-11-20; drive-size:12003802; drive-modified:2024-01-25T08:59:54.631Z; sha256:0f8931be648077d6775d1c866376fef775bb3f8568448f94d30493d56b945fda#pdf-page=22","source":"多維度圖式研究案報告(修訂版).pdf; Drive file 1C-2N1JDxr9JHc6s2b2AvHJ1HwxndCXRy; printed page 10; PDF page 22; Figure 2-3"},{"authority_class":"authoritative-versioned-source-documentation","claim":"V4 defines the logical polygon layer (三)建物BUILD(面), terrain codes 9310100/9310200/9310300, and fields BUILD_ID,TERRAINID,BUILD_STR,BUILD_NO,BUILD_H,GROUP_ID,MDATE; it does not publish a J13/J17 package-member production binding","evidence_id":"multidimensional-layer-v4-build-schema","identity":"V4; decision-date:2023-11-10; drive-size:569257; drive-modified:2024-01-25T08:59:54.631Z; sha256:d3f065a57d10c306e9e4e686641c07ddf2fb5a6d3638b68ec4d3ea533839f308","source":"多維度繪製圖層V4.xlsx; Drive file 1C12PmP-8ZZtZbHVKRAKv0mmWE22kgzEw"},{"authority_class":"authoritative-metadata","claim":"J13_BUILD and J17_BUILD are distinct source members in different geographic/project scopes with PolygonZ and the observed BUILD field set; member presence does not establish NMA production applicability","evidence_id":"multidimensional-source-package-members","identity":"sha256:4888dbf9a838ed5c41e20c3b528c542c7e52845b4d8e4809f58ea5afcec2da53","source":"data/datasets/112年多維度SHP成果_0502.zip"},{"authority_class":"implementation-and-demo-evidence","claim":"J13 DEMO selection and J17 runtime history are corroborative only and cannot create an official production binding","evidence_id":"build00a-demo-and-current-runtime","identity":"BUILD-00A fixture plus BUILD-09E predecessor implementation boundary","source":"data/specifications/nma-build-fixture-manifest-v1.0.json; src/nma/real_layer.py"}],"five_gate_state":[{"gate_id":"hatch-angle-asset","reason":"BUILD-09E official diagonal and 2 mm spacing findings remain frozen; numeric angle and resource remain local","state":"local-policy-required"},{"gate_id":"annotation-placement-binding","reason":"BUILD-09E content and placement semantics remain frozen; the production placement algorithm remains local","state":"local-policy-required"},{"gate_id":"j13-j17-schema-identity","reason":"logical BUILD is versioned, but the available authority does not publish J13/J17 NMA production applicability","state":"HOLD-indeterminate"},{"gate_id":"line-colour-portrayal","reason":"official 0.20 mm and RGB (0,0,0) boundaries are closed; renderer conversion remains a human output-profile policy","state":"local-output-profile-policy-required"},{"gate_id":"polygonz-derived-xy","reason":"immutable PolygonZ and non-writing derived XY architecture is unchanged","state":"P2-production-candidate"}],"frozen_build09e_results":{"annotation_closure":{"collision_suppression":{"official_semantics":"avoid interference with features and other annotations","outcome":"local-policy-required","unofficial_detail":"priority, fit, and suppression algorithm"},"content":{"outcome":"officially-supported","rule":"floor count followed by structure"},"field_binding":{"outcome":"documented-source-semantics","rule":"{BUILD_NO}{BUILD_STR}","scope":"112 multidimensional source package only"},"formatting_order":{"outcome":"documented-source-semantics","rule":"floor then structure; exact typography and separator remain local policy"},"placement":{"official_semantics":"center in or near the feature at an appropriate location; do not cover the feature; avoid mapped features, control points, and grid lines","outcome":"local-policy-required","unofficial_detail":"exact anchor algorithm"},"scale_visibility":{"official_semantics":null,"outcome":"local-policy-required","unofficial_detail":"web zoom thresholds"}},"hatch_angle":{"forbidden_inference":"diagonal does not establish 45 degrees","outcome":"local-policy-required-with-official-diagonal-semantics","value_degrees":null},"hatch_pattern_orientation":{"numeric_angle":null,"outcome":"officially-supported","semantic":"diagonal rising from lower-left to upper-right"},"hatch_resource":{"allowed_form":"procedural-or-independently-reviewed-equivalent","created_or_deployed":false,"exact_asset_required":false,"outcome":"local-policy-required"},"hatch_spacing":{"outcome":"officially-supported","unit":"mm","value":2.0},"polygonz_derived_xy":{"derived_xy_representation":{"authoritative":false,"geometry_repair_permitted":false,"materialization":"ephemeral-or-content-addressed-read-only-cache","non_writing":true,"purpose":"portrayal-only","rendering_consumes_derived_only":true,"source_mutation_capability":false},"legacy_drop_z_path":{"classification":"incompatible","disposition":"bypassed-by-future-non-writing-derived-view-adapter","reuse_as_is_allowed":false},"pipeline":["authoritative-PolygonZ","immutable-source-representation","derived-non-writing-XY-portrayal-view","rendering-adapter"],"production_execution_allowed":false,"provenance_binding_required":["source archive SHA-256","selected source layer and component SHA-256 values","source feature identity","source PolygonZ geometry hash including Z","derivation algorithm and version","source and output CRS","derived XY content hash"],"source_mutation_authority":false,"source_representation":{"authoritative":true,"immutable":true,"write_handle_exposed_to_deriver":false,"z_values_preserved_and_recoverable":true},"status":"production-candidate-design-only"}},"j13_j17_resolution":{"authoritative_binding_traces":[],"available_product_trace":{"building_semantic_role":{"evidence_ids":["multidimensional-layer-v4-build-schema","nlsc112v5.4-building-portrayal-row"],"value":"Building polygons for permanent, under-construction, and temporary buildings"},"dataset_product_package":{"evidence_ids":["multidimensional-layer-v4-build-schema"],"value":"multidimensional spatial-information base-map layer definition"},"field_schema":{"evidence_ids":["multidimensional-layer-v4-build-schema","multidimensional-source-package-members"],"value":"BUILD_ID,TERRAINID,BUILD_STR,BUILD_NO,BUILD_H,GROUP_ID,MDATE"},"geographic_product_scope":{"evidence_ids":["multidimensional-layer-v4-build-schema","multidimensional-source-package-members"],"value":"logical product schema; no J13/J17 member scope is assigned"},"geometry":{"evidence_ids":["multidimensional-layer-v4-build-schema","multidimensional-source-package-members"],"value":"面 (polygon); observed package members are PolygonZ"},"layer_code":{"evidence_ids":["multidimensional-layer-v4-build-schema"],"value":"BUILD"},"layer_title_meaning":{"evidence_ids":["multidimensional-layer-v4-build-schema"],"value":"(三)建物BUILD(面)"},"nma_production_applicability":{"evidence_ids":["multidimensional-layer-v4-build-schema","multidimensional-source-package-members"],"value":"not-published-or-not-available for J13_BUILD versus J17_BUILD"},"official_specification":{"evidence_